{
  "schema_version": 1,
  "name": "Mine Low ER - 4 Garage + HR50",
  "width": 20,
  "height": 20,
  "placements": [
    {
      "id": "p01",
      "facility_id": 82,
      "x": 0,
      "y": 1,
      "orientation": "v",
      "fixed": true
    },
    {
      "id": "p02",
      "facility_id": 82,
      "x": 4,
      "y": 1,
      "orientation": "v",
      "fixed": true
    },
    {
      "id": "p03",
      "facility_id": 3,
      "x": 13,
      "y": 1,
      "orientation": "v",
      "fixed": true
    },
    {
      "id": "p04",
      "facility_id": 3,
      "x": 14,
      "y": 1,
      "orientation": "v",
      "fixed": true
    },
    {
      "id": "p05",
      "facility_id": 3,
      "x": 15,
      "y": 1,
      "orientation": "v",
      "fixed": true
    },
    {
      "id": "p06",
      "facility_id": 3,
      "x": 16,
      "y": 1,
      "orientation": "v",
      "fixed": true
    },
    {
      "id": "p07",
      "facility_id": 20,
      "x": 17,
      "y": 1,
      "orientation": "v",
      "fixed": true
    },
    {
      "id": "p08",
      "facility_id": 20,
      "x": 18,
      "y": 1,
      "orientation": "v",
      "fixed": true
    },
    {
      "id": "p09",
      "facility_id": 20,
      "x": 19,
      "y": 1,
      "orientation": "v",
      "fixed": true
    },
    {
      "id": "p10",
      "facility_id": 82,
      "x": 2,
      "y": 5,
      "orientation": "v",
      "fixed": true
    },
    {
      "id": "p11",
      "facility_id": 7,
      "x": 6,
      "y": 6,
      "orientation": "v",
      "fixed": true
    },
    {
      "id": "p12",
      "facility_id": 4,
      "x": 0,
      "y": 9,
      "orientation": "v",
      "fixed": true
    },
    {
      "id": "p13",
      "facility_id": 4,
      "x": 1,
      "y": 9,
      "orientation": "v",
      "fixed": true
    },
    {
      "id": "p14",
      "facility_id": 82,
      "x": 2,
      "y": 9,
      "orientation": "v",
      "fixed": true
    },
    {
      "id": "p15",
      "facility_id": 82,
      "x": 1,
      "y": 13,
      "orientation": "v",
      "fixed": true
    },
    {
      "id": "p16",
      "facility_id": 2,
      "x": 0,
      "y": 13,
      "orientation": "v",
      "fixed": true
    },
    {
      "id": "p17",
      "facility_id": 7,
      "x": 5,
      "y": 13,
      "orientation": "v",
      "fixed": true
    },
    {
      "id": "p18",
      "facility_id": 49,
      "x": 13,
      "y": 13,
      "orientation": "v",
      "fixed": true
    },
    {
      "id": "p19",
      "facility_id": 2,
      "x": 3,
      "y": 1,
      "orientation": "v",
      "fixed": true
    },
    {
      "id": "p20",
      "facility_id": 70,
      "x": 1,
      "y": 16,
      "orientation": "h",
      "fixed": true
    },
    {
      "id": "p21",
      "facility_id": 4,
      "x": 1,
      "y": 5,
      "orientation": "v",
      "fixed": true
    },
    {
      "id": "p22",
      "facility_id": 4,
      "x": 0,
      "y": 5,
      "orientation": "v",
      "fixed": true
    },
    {
      "id": "p23",
      "facility_id": 44,
      "x": 8,
      "y": 0,
      "orientation": "v",
      "fixed": true
    },
    {
      "id": "p24",
      "facility_id": 49,
      "x": 13,
      "y": 5,
      "orientation": "v",
      "fixed": true
    },
    {
      "id": "p25",
      "facility_id": 2,
      "x": 1,
      "y": 17,
      "orientation": "h",
      "fixed": true
    },
    {
      "id": "p26",
      "facility_id": 2,
      "x": 1,
      "y": 18,
      "orientation": "h",
      "fixed": true
    },
    {
      "id": "p27",
      "facility_id": 70,
      "x": 1,
      "y": 19,
      "orientation": "h",
      "fixed": true
    },
    {
      "id": "p28",
      "facility_id": 70,
      "x": 2,
      "y": 8,
      "orientation": "h",
      "fixed": true
    },
    {
      "id": "p29",
      "facility_id": 70,
      "x": 4,
      "y": 0,
      "orientation": "h",
      "fixed": true
    }
  ],
  "designer_state": "|4|v",
  "source_url": "https://www.swcombine.com/citydesigner/index.php?code=82,0,1,v;82,4,1,v;3,13,1,v;3,14,1,v;3,15,1,v;3,16,1,v;20,17,1,v;20,18,1,v;20,19,1,v;82,2,5,v;7,6,6,v;4,0,9,v;4,1,9,v;82,2,9,v;82,1,13,v;2,0,13,v;7,5,13,v;49,13,13,v;2,3,1,v;70,1,16,h;4,1,5,v;4,0,5,v;44,8,0,v;49,13,5,v;2,1,17,h;2,1,18,h;70,1,19,h;70,2,8,h;70,4,0,h;|4|v"
}
